statement error expected DEFAULT expression to have type int, but 'false' has type bool
CREATE TABLE t (a INT8 PRIMARY KEY DEFAULT false)

statement error variable sub-expressions are not allowed in DEFAULT
CREATE TABLE t (a INT8 PRIMARY KEY DEFAULT (SELECT 1))

statement error variable sub-expressions are not allowed in DEFAULT
CREATE TABLE t (a INT8 PRIMARY KEY DEFAULT b)

# Issue #14308: support tables with DEFAULT NULL columns.
statement ok
CREATE TABLE null_default (ts TIMESTAMP PRIMARY KEY NULL DEFAULT NULL)

# Aggregate function calls in CHECK are not ok.
statement error aggregate functions are not allowed in DEFAULT
CREATE TABLE bad (a INT8 DEFAULT count(1))

# Window function calls in CHECK are not ok.
statement error window functions are not allowed in DEFAULT
CREATE TABLE bad (a INT8 DEFAULT count(1) OVER ())

statement ok
CREATE TABLE t (
  a INT8 PRIMARY KEY DEFAULT 42,
  b TIMESTAMP DEFAULT now(),
  c FLOAT DEFAULT random(),
  d DATE DEFAULT now()
)

query TTBTTTBB colnames
SHOW COLUMNS FROM t
----
column_name  data_type  is_nullable  column_default     generation_expression  indices    is_hidden  is_tag
a            INT8       false        42                 ·                      {primary}  false      false
b            TIMESTAMP  true         now():::TIMESTAMP  ·                      {}         false      false
c            FLOAT8     true         random()           ·                      {}         false      false
d            DATE       true         now():::DATE       ·                      {}         false      false

statement ok
COMMENT ON COLUMN t.a IS 'a'

query TTBTTTBBT colnames
SHOW COLUMNS FROM t WITH COMMENT
----
column_name  data_type  is_nullable  column_default     generation_expression  indices    is_hidden  is_tag  comment
a            INT8       false        42          ·                      {primary}  false      false   a
b            TIMESTAMP  true         now():::TIMESTAMP  ·                      {}         false      false   NULL
c            FLOAT8     true         random()           ·                      {}         false      false   NULL
d            DATE       true         now():::DATE       ·                      {}         false      false   NULL

statement ok
INSERT INTO t VALUES (DEFAULT, DEFAULT, DEFAULT, DEFAULT)

query IBBB
SELECT a, b <= now(), c >= 0.0, d <= now() FROM t
----
42 true true true

statement ok
TRUNCATE TABLE t

statement ok
INSERT INTO t DEFAULT VALUES

query IBBB
SELECT a, b <= now(), c >= 0.0, d <= now() FROM t
----
42 true true true

statement ok
INSERT INTO t (a) VALUES (1)

query IBBB
SELECT a, b <= now(), c >= 0.0, d <= now() FROM t WHERE a = 1
----
1 true true true

statement ok
INSERT INTO t VALUES (2)

query IBBB
SELECT a, b <= now(), c >= 0.0, d <= now() FROM t WHERE a = 2
----
2 true true true

statement ok
UPDATE t SET (b, c) = ('2015-09-18 00:00:00', -1.0)

statement ok
UPDATE t SET b = DEFAULT WHERE a = 1

query IBBB
SELECT a, b <= now(), c = -1.0, d <= now() FROM t WHERE a = 1
----
1 true true true

statement ok
UPDATE t SET (b, c) = (DEFAULT, DEFAULT) WHERE a = 2

query IBBB
SELECT a, b <= now(), c >= 0.0, d <= now() FROM t WHERE a = 2
----
2 true true true

statement ok
UPDATE t SET b = DEFAULT, c = DEFAULT, d = DEFAULT

statement ok
UPDATE t SET (b) = (DEFAULT), (c) = (DEFAULT), (d) = (DEFAULT)

# Test a table without a default and with a null default
statement ok
CREATE TABLE v (
  a INT8 PRIMARY KEY,
  b TIMESTAMP NULL DEFAULT NULL,
  c INT8
)

statement ok
UPDATE v SET a = DEFAULT

statement ok
UPDATE v SET (a, c) = (DEFAULT, DEFAULT)

query TTBTTTBB colnames
SHOW COLUMNS FROM v
----
column_name  data_type  is_nullable  column_default  generation_expression  indices    is_hidden  is_tag
a            INT8       false        NULL            ·                      {primary}  false      false
b            TIMESTAMP  true         NULL            ·                      {}         false      false
c            INT8       true         NULL            ·                      {}         false      false

# Regression test for #34901: verify that builtins can be used in default value
# expressions without a "memory budget exceeded" error while backfilling
statement ok
CREATE TABLE t34901 (x STRING)

statement ok
INSERT INTO t34901 VALUES ('a')

statement ok
ALTER TABLE t34901 ADD COLUMN y STRING DEFAULT (concat('b', 'c'))

query TT
SELECT * FROM t34901
----
a  bc
