Parsed test spec with 2 sessions

starting permutation: s1 s2 s1l s1svp s1d s1r s1c s2l s2c
step s1: BEGIN transaction isolation level read committed;  finished.
step s2: BEGIN transaction isolation level read committed;  finished.
step s1l: SELECT * FROM foo;  finished.
key|value
---+-----
  1|    1
(1 row)

step s1svp: SAVEPOINT f;  finished.
step s1d: DELETE FROM foo WHERE TRUE;  finished.
step s1r: ROLLBACK TO f;  finished.
step s1c: COMMIT;  finished.
step s2l: SELECT * FROM foo FOR UPDATE;  finished.
key|value
---+-----
  1|    1
(1 row)

step s2c: COMMIT;  finished.

starting permutation: s1 s2 s1l s1svp s1d s1r s2l s1c s2c
step s1: BEGIN transaction isolation level read committed;  finished.
step s2: BEGIN transaction isolation level read committed;  finished.
step s1l: SELECT * FROM foo;  finished.
key|value
---+-----
  1|    1
(1 row)

step s1svp: SAVEPOINT f;  finished.
step s1d: DELETE FROM foo WHERE TRUE;  finished.
step s1r: ROLLBACK TO f;  finished.
step s2l: SELECT * FROM foo FOR UPDATE; <waiting ...>
step s1c: COMMIT;  finished.
step s2l: <... completed>
key|value
---+-----
  1|    1
(1 row)

step s2c: COMMIT;  finished.

starting permutation: s1 s2 s1l s1svp s1d s2l s1r s1c s2c
step s1: BEGIN transaction isolation level read committed;  finished.
step s2: BEGIN transaction isolation level read committed;  finished.
step s1l: SELECT * FROM foo;  finished.
key|value
---+-----
  1|    1
(1 row)

step s1svp: SAVEPOINT f;  finished.
step s1d: DELETE FROM foo WHERE TRUE;  finished.
step s2l: SELECT * FROM foo FOR UPDATE; <waiting ...>
step s1r: ROLLBACK TO f;  finished.
step s1c: COMMIT;  finished.
step s2l: <... completed>
key|value
---+-----
  1|    1
(1 row)

step s2c: COMMIT;  finished.

starting permutation: s1 s2 s2l s1l s2c s1svp s1d s1r s1c
step s1: BEGIN transaction isolation level read committed;  finished.
step s2: BEGIN transaction isolation level read committed;  finished.
step s2l: SELECT * FROM foo FOR UPDATE;  finished.
key|value
---+-----
  1|    1
(1 row)

step s1l: SELECT * FROM foo;  finished.
key|value
---+-----
  1|    1
(1 row)

step s2c: COMMIT;  finished.
step s1svp: SAVEPOINT f;  finished.
step s1d: DELETE FROM foo WHERE TRUE;  finished.
step s1r: ROLLBACK TO f;  finished.
step s1c: COMMIT;  finished.

starting permutation: s1 s2 s2l s2c s1l s1svp s1d s1r s1c
step s1: BEGIN transaction isolation level read committed;  finished.
step s2: BEGIN transaction isolation level read committed;  finished.
step s2l: SELECT * FROM foo FOR UPDATE;  finished.
key|value
---+-----
  1|    1
(1 row)

step s2c: COMMIT;  finished.
step s1l: SELECT * FROM foo;  finished.
key|value
---+-----
  1|    1
(1 row)

step s1svp: SAVEPOINT f;  finished.
step s1d: DELETE FROM foo WHERE TRUE;  finished.
step s1r: ROLLBACK TO f;  finished.
step s1c: COMMIT;  finished.
