Parsed test spec with 2 sessions

starting permutation: s1 s2 s1w s2u s1r1 s1r2 s1c s2r1 s2r2 s2c
step s1: BEGIN transaction isolation level read committed;  finished.
step s2: BEGIN transaction isolation level read committed;  finished.
step s1w: INSERT INTO bar VALUES (42);  finished.
step s2u: UPDATE foo SET b = 'Hello World';  finished.
step s1r1: select * from foo;  finished.
 a|b
--+-
42| 
(1 row)

step s1r2: select * from bar;  finished.
 a
--
42
(1 row)

step s1c: COMMIT;  finished.
step s2r1: select * from foo;  finished.
 a|b          
--+-----------
42|Hello World
(1 row)

step s2r2: select * from bar;  finished.
 a
--
42
(1 row)

step s2c: COMMIT;  finished.

starting permutation: s1 s2 s1w s2u s2r1 s2r2 s2c s1r1 s1r2 s1c
step s1: BEGIN transaction isolation level read committed;  finished.
step s2: BEGIN transaction isolation level read committed;  finished.
step s1w: INSERT INTO bar VALUES (42);  finished.
step s2u: UPDATE foo SET b = 'Hello World';  finished.
step s2r1: select * from foo;  finished.
 a|b          
--+-----------
42|Hello World
(1 row)

step s2r2: select * from bar;  finished.
a
-
(0 rows)

step s2c: COMMIT;  finished.
step s1r1: select * from foo;  finished.
 a|b          
--+-----------
42|Hello World
(1 row)

step s1r2: select * from bar;  finished.
 a
--
42
(1 row)

step s1c: COMMIT;  finished.

starting permutation: s1 s2 s1w s2r1 s2r2 s2u s1r1 s1r2 s1c s2c
step s1: BEGIN transaction isolation level read committed;  finished.
step s2: BEGIN transaction isolation level read committed;  finished.
step s1w: INSERT INTO bar VALUES (42);  finished.
step s2r1: select * from foo;  finished.
 a|b
--+-
42| 
(1 row)

step s2r2: select * from bar;  finished.
a
-
(0 rows)

step s2u: UPDATE foo SET b = 'Hello World';  finished.
step s1r1: select * from foo;  finished.
 a|b
--+-
42| 
(1 row)

step s1r2: select * from bar;  finished.
 a
--
42
(1 row)

step s1c: COMMIT;  finished.
step s2c: COMMIT;  finished.

starting permutation: s1 s2 s1w s2r1 s2r2 s2u s1r1 s1r2 s2c s1c
step s1: BEGIN transaction isolation level read committed;  finished.
step s2: BEGIN transaction isolation level read committed;  finished.
step s1w: INSERT INTO bar VALUES (42);  finished.
step s2r1: select * from foo;  finished.
 a|b
--+-
42| 
(1 row)

step s2r2: select * from bar;  finished.
a
-
(0 rows)

step s2u: UPDATE foo SET b = 'Hello World';  finished.
step s1r1: select * from foo;  finished.
 a|b
--+-
42| 
(1 row)

step s1r2: select * from bar;  finished.
 a
--
42
(1 row)

step s2c: COMMIT;  finished.
step s1c: COMMIT;  finished.
